topic,headline,time
Axis Bank (AXISBANK),Why change the address in your Bank Account?,2024-09-03 07:00:00
Axis Bank (AXISBANK),AXISBANK Elliott Wave technical analysis [Video],2024-09-02 07:00:00
Axis Bank (AXISBANK),Here's Why Axis Bank (NSE:AXISBANK) Has Caught The Eye Of Investors,2024-08-30 07:00:00
Axis Bank (AXISBANK),Institutional investors in Axis Bank Limited (NSE:AXISBANK) lost 5.9% last week but have reaped the benefits of longer-term growth,2024-03-18 07:00:00
Axis Bank (AXISBANK),Axis Bank expands its omni-channel shopping segment through its Credit Card partnership with Shoppers Stop,2024-04-16 07:00:00
Axis Bank (AXISBANK),Axis Bank facilitates seamless GST payments for its Commercial Card Clients,2024-08-07 07:00:00
Axis Bank (AXISBANK),6 quick ways for Credit Card activation,2024-01-23 13:20:03
Axis Bank (AXISBANK),Unclaimed deposits simplified: Know how to access your unused funds,2024-04-10 07:00:00
Axis Bank (AXISBANK),How to Link Mobile Number With Bank Account Easily,2023-12-29 08:00:00
Axis Bank (AXISBANK),"Axis Bank announces the winners of SPLASH, a pan-India competition for Art, Craft and Literature",2024-03-13 07:00:00
Axis Bank (AXISBANK),"Axis Bank Outlook for the Week (May 06, 2024 – May 10, 2024)",2024-05-03 07:00:00
Axis Bank (AXISBANK),Everything you need to know about Gold Loan moratorium,2024-07-18 07:00:00
Axis Bank (AXISBANK),Debit Card Pin Generation: How to Create Debit Card Pin?,2024-02-05 08:00:00
Axis Bank (AXISBANK),Axis Bank Full Year 2024 Earnings: EPS: ₹85.62 (vs ₹35.21 in FY 2023),2024-07-03 07:00:00
Axis Bank (AXISBANK),"Axis Bank Outlook for the Week (April 15, 2024 – April 19, 2024)",2024-04-12 07:00:00
Axis Bank (AXISBANK),How to check your Credit Card application status,2024-03-05 08:00:00
Axis Bank (AXISBANK),"Axis Bank Outlook for the Week (May 27, 2024 – May 31, 2024)",2024-05-24 07:00:00
Axis Bank (AXISBANK),Axis Bank and Fibe Partner to Launch India’s First Numberless Credit Card,2023-10-10 07:00:00
Axis Bank (AXISBANK),Budget 2024: Decoding changes in tax slabs & capital gains,2024-07-25 07:00:00
Axis Bank (AXISBANK),"Stocks to buy, sell: Axis Bank, Indus Towers, Suzlon Energy, LIC Housing Finance, L&T Finance, among analysts' top picks",2024-09-11 03:45:06
Axis Bank (AXISBANK),AXISBANK Outlook for the Week,2024-08-20 12:24:48
Axis Bank (AXISBANK),Axis Bank Ltd - AXISBANK Share Price Live Today,2024-07-30 12:17:32
Axis Bank (AXISBANK),Block deal: Axis Bank shares in focus as Bain Capital entities may sell $444 million worth stocks,2023-12-13 08:00:00
Axis Bank (AXISBANK),Axis Bank credit card users report fraud transactions,2024-03-27 07:00:00
Axis Bank (AXISBANK),Axis Bank Customer Care Number: Contact Experts for Quick Assistance,2024-05-09 07:00:00
Axis Bank (AXISBANK),"Axis Bank Q4 FY24 Results Preview: Net profit likely at Rs 6,250 crore, NIM may shrink by 11 bps sequential...",2024-04-23 07:00:00
Axis Bank (AXISBANK),"Axis Bank Launches SPLASH, a pan-India competition to engage young minds through Art, Craft and Literature",2023-11-23 08:00:00
Axis Bank (AXISBANK),Axis Bank Q1 Results: Private sector lender meets Street estimates with 12% NII growth; asset quality deter...,2024-07-25 07:00:00
Axis Bank (AXISBANK),"Should you buy Axis Bank, Sun Pharma, GAIL, other stocks today? Here is what brokerages recommend",2024-06-11 07:00:00
Axis Bank (AXISBANK),Have Total Control on your Credit Card functionalities,2021-10-06 06:20:11
Axis Bank (AXISBANK),"Axis Bank launches ‘Infinity Savings Account’, a zero domestic transaction fee-based account",2023-08-29 07:00:00
Axis Bank (AXISBANK),Axis Bank announces -ComeAsYouAre- a Charter of policies and practices for employees and customers from the LGBTQIA+ community,2021-09-06 07:00:00
Axis Bank (AXISBANK),Axis Bank enters Asia Book of Records for its Clean-A-Thon Initiative,2023-07-27 07:00:00
Axis Bank (AXISBANK),Learn Why and How to Build Your Emergency Funds,2022-12-27 08:00:00
Axis Bank (AXISBANK),Axis Bank starts digital lending through Account Aggregator Framework,2022-09-22 07:00:00
Axis Bank (AXISBANK),Open Digital Savings Account Instantly with Video KYC,2020-07-16 15:39:01
Axis Bank (AXISBANK),"Axis Bank launches Sarathi, a digital onboarding platform for POS Terminals, streamlining the merchant acquisition process",2023-05-23 07:00:00
Axis Bank (AXISBANK),Axis Bank announces its ‘Dil Se Open Celebrations’; offers lucrative deals and discounts across e-commerce platforms and local retailers,2021-10-19 07:00:00
Axis Bank (AXISBANK),How to Stay Safe from New Digital Scams and Frauds,2020-07-27 07:00:00
Axis Bank (AXISBANK),How to Pay Your Loan EMI and Credit Card Dues Using UPI,2020-10-28 07:00:00
Axis Bank (AXISBANK),Axis Bank launches Sampann premium banking services for Rural and Semi-Urban customers,2023-07-31 07:00:00
Axis Bank (AXISBANK),Axis Bank partners with Kiwi to bolster 'Credit on UPI' accessibility on RuPay credit cards,2023-08-02 07:00:00
Axis Bank (AXISBANK),Axis Bank launches a wide range of API Banking solutions,2021-10-11 07:00:00
Axis Bank (AXISBANK),Priority Banking Program,2022-04-04 16:48:19
Axis Bank (AXISBANK),Axis Bank offers ‘Axis Republic’ to Maharashtra Forest Department,2021-12-22 08:00:00
Axis Bank (AXISBANK),Axis Bank offers flat 10-15% off on major e-commerce platforms for it’s ASAP Digital Savings Account,2021-10-04 07:00:00
Axis Bank (AXISBANK),Axis Bank Q2 Results 2024 - Find Axis Bank Q2 Earnings Result | AXISBANK Q2 results,2023-09-24 11:45:39
Axis Bank (AXISBANK),ASAP Digital Salary Accounts,2023-04-25 10:22:40
Axis Bank (AXISBANK),How Does Video-KYC Work? Open Full KYC Account without Physical Documents,2020-07-16 07:00:00
Axis Bank (AXISBANK),How To Redeem Rewards On Credit Cards?,2023-04-05 07:00:00
Axis Bank (AXISBANK),Axis Bank launches ACE Credit Card in collaboration with Google Pay and Visa,2020-10-12 07:00:00
Axis Bank (AXISBANK),Axis Bank shareholdings: Find Axis Bank Shareholding Pattern and Ownership,2023-05-29 21:16:48
Axis Bank (AXISBANK),"Axis Bank Outlook for the Week (Feb 13, 2023 – Feb 17, 2023)",2023-02-13 08:00:00
Axis Bank (AXISBANK),tips to consider before taking personal loan for medical emergency,2021-09-08 07:00:00
Axis Bank (AXISBANK),"Axis Bank Ltd Share Price Today, AXISBANK Share Price NSE, BSE",2023-01-23 13:05:07
Axis Bank (AXISBANK),About Us - Axis Bank - Third Largest Private Sector Bank in India,2016-09-23 19:17:50
Axis Bank (AXISBANK),Axis Bank launches Aura a credit card exclusively loaded with affordable health and wellness solutions,2021-01-19 08:00:00
Axis Bank (AXISBANK),RD Calculator : Recurring Deposit Interest Rate Calculator Online,2019-05-17 11:35:53
Axis Bank (AXISBANK),"Axis Bank Outlook for the Week (May 01, 2023 – May 05, 2023)",2023-04-30 07:00:00
Axis Bank (AXISBANK),"AXIS Bank Outlook for the Week (July 17, 2023 to July 21, 2023)",2023-07-14 07:00:00
Axis Bank (AXISBANK),dil se open to bigger opportunities,2016-09-23 20:29:09
Axis Bank (AXISBANK),"Axis Bank Outlook for the Week (March 14, 2022 – March 18, 2022)",2022-03-12 08:00:00
Axis Bank (AXISBANK),Axis Bank Share Price Today - Axis Bank Limited Stock Price Live NSE/BSE,2022-01-08 16:14:35
Axis Bank (AXISBANK),"Axis Bank Outlook for the Week (Jan 02, 2023 – Jan 06, 2023)",2023-01-01 08:00:00
Axis Bank (AXISBANK),"Axis Bank Outlook for the Week (Dec 19, 2022 – Dec 23, 2022)",2022-12-17 08:00:00
Axis Bank (AXISBANK),Use Autopay Feature on Your Credit Card to Make Payments,2022-01-28 08:00:00
Axis Bank (AXISBANK),"Axis Bank Outlook for the Week (March 22,2021 – March 26,2021)",2021-03-21 07:00:00
Axis Bank (AXISBANK),"Axis Bank Outlook for the Week (Jan 10,2022 – Jan 14,2022)",2022-01-08 08:00:00
Axis Bank (AXISBANK),"Axis Bank Outlook for the Week (March 29,2021 – April 02,2021)",2021-03-27 07:00:00
Axis Bank (AXISBANK),"Axis Bank FASTag: Know how to apply, charges, recharge process",2019-12-05 08:00:00
Axis Bank (AXISBANK),Axis Bank Ltd Stock Price: Axis Bank Share Price Today,2021-02-24 22:28:35
Axis Bank (AXISBANK),Axis Bank Recruitment 2024 - Live Vacancies on 12.09.2024 - JobsCloud,2019-10-08 00:29:27
Adani Enterprises (ADANIENT),This Is The Reason Why We Think Adani Enterprises Limited's (NSE:ADANIENT) CEO Might Be Underpaid,2024-06-18 07:00:00
Adani Enterprises (ADANIENT),"Adani Group stocks Adani Ent, Adani Ports trade flat after Hindenburg response",2024-07-02 07:00:00
Adani Enterprises (ADANIENT),"Investors shrug off Hindenburg response, Adani Group stocks Adani Ent, Adani Ports trade flat | Stock Market News",2024-07-02 07:00:00
Adani Enterprises (ADANIENT),"Adani Enterprises to return to equity market with $1 billion share sale, sources say",2024-08-07 07:00:00
Adani Enterprises (ADANIENT),"Adani Ent, Adani Energy Solutions to consider fundraising next week",2024-05-26 07:00:00
Adani Enterprises (ADANIENT),Adani Enterprises shares set to replace Wipro in Sensex; stock jumps 9% to hit one-year high,2024-05-23 07:00:00
Adani Enterprises (ADANIENT),"Gautam Adani's Salary Jumps To ₹2.46 Cr, But Still Not Highest Paid Adani Ent Employee",2024-05-30 07:00:00
Adani Enterprises (ADANIENT),Adani Enterprises Share Price (NSE: ADANIENT) Up After Strong Airport Arm Results,2024-06-10 07:00:00
Adani Enterprises (ADANIENT),"Jefferies sees Adani Ent an attractive play on capex theme, starts coverage with 19% upside",2024-02-13 08:00:00
Adani Enterprises (ADANIENT),Adani Enterprises First Quarter 2025 Earnings: EPS: ₹12.33 (vs ₹5.91 in 1Q 2024),2024-08-08 07:00:00
Adani Enterprises (ADANIENT),"Adani group stocks fall; ACC down 3%, Adani Ent slips 1.5%",2024-07-04 07:00:00
Adani Enterprises (ADANIENT),"Adani Group stocks fall up to 13%; Adani Green, Adani Ent, Adani Ports shares top losers | Stock Market News",2024-03-13 07:00:00
Adani Enterprises (ADANIENT),"Adani Enterprises Q1 Results: Cons PAT zooms 116% YoY to Rs 1,454 crore",2024-08-01 07:00:00
Adani Enterprises (ADANIENT),"Adani Group stocks down 13%, ₹90,000 cr wiped off in market-cap. Top loser is…",2024-03-13 07:00:00
Adani Enterprises (ADANIENT),Gautam Adani ups stake in group's flagship firm Adani Enterprises via open market,2024-06-14 07:00:00
Adani Enterprises (ADANIENT),"Adani Enterprises Q1 Results: Net profit zooms 116% to ₹1,454 crore, revenue up 13% YoY; FMCG biz demerger approved | Company Business News",2024-08-01 07:00:00
Adani Enterprises (ADANIENT),Adani Enterprises & SBI: Here's what Vinit Bolinjkar of Ventura Securities says on these 2 stocks,2024-03-01 08:00:00
Adani Enterprises (ADANIENT),"Stocks to Watch: RIL, GIC Re, Suzlon Energy, HDFC Bank, Mastek, Adani Ent",2024-09-05 07:00:00
Adani Enterprises (ADANIENT),"Adani Enterprises Q4 results highlights: Profit plunges 39%; dividend announced; record date, management commentary & more",2024-05-02 07:00:00
Adani Enterprises (ADANIENT),"Adani Enterprises Q1 FY25 results: Net profit zooms 116% to Rs 1,455 crore; revenue up 11%",2024-08-01 07:00:00
Adani Enterprises (ADANIENT),Adani Ent gets 2 Sebi notices over related party deals,2024-05-03 07:00:00
Adani Enterprises (ADANIENT),"Jugeshinder Singh, Group CFO On Adani Ent Q1 Earnings & Growth Blueprint",2024-08-01 07:00:00
Adani Enterprises (ADANIENT),"Adani Ent gains as Q1 PAT soars 116% YoY to Rs 1,454 cr",2024-08-02 07:00:00
Adani Enterprises (ADANIENT),"Adani Enterprises Q3 Results: Net profit rises to ₹1,888 crore, revenue up 6.5% YoY | Company Business News",2024-02-01 08:00:00
Adani Enterprises (ADANIENT),"Do You Own These Expert-Recommended Adani Stocks? Bullish On Adani Ent, Green & Transmission",2024-07-08 07:00:00
Adani Enterprises (ADANIENT),"Stocks To Watch: Adani Green, Glenmark, Venus Pipes, Adani Ent, Indigo Paints, And Others",2024-09-06 07:00:00
Adani Enterprises (ADANIENT),Adani Group stocks climb up to 6%. Adani Ent top gainer,2024-01-29 08:00:00
Adani Enterprises (ADANIENT),"Adani Enterprises Outlook for the Week (June 03, 2024 – June 07, 2024)",2024-05-31 07:00:00
Adani Enterprises (ADANIENT),Jefferies starts ‘buy’ call on Adani Ent; Moody’s changes ratings on 4 group firms to 'stable',2024-02-14 08:00:00
Adani Enterprises (ADANIENT),"Adani stocks shrug off coal supply report, all 10 listed shares settle higher",2024-05-23 07:00:00
Adani Enterprises (ADANIENT),Adani Enterprises shares rally over 9% on SC verdict; what's next for Adani Group's flagship firm,2024-01-03 08:00:00
Adani Enterprises (ADANIENT),"Stocks To Pick From Adani Basket. Kunal Rambhia's First Intermediate Target On Adani Ent. ₹3,600",2024-02-09 08:00:00
Adani Enterprises (ADANIENT),Adani Ent to demerge food FMCG biz and transfer to Adani Wilmar,2024-08-01 07:00:00
Adani Enterprises (ADANIENT),"Dividend Stocks: Tata Motors, HUL, Adani Ent, Bajaj Auto, among others to trade ex-dividend next week; Full list here | Stock Market News",2024-06-08 07:00:00
Adani Enterprises (ADANIENT),"Stocks to Watch, May 3: Dabur, Adani Ent, Ceat, IEX, Godrej Prop, MRF, CIL",2024-05-03 07:00:00
Adani Enterprises (ADANIENT),Adani Ent plans to raise $1bn from share sale,2024-08-08 07:00:00
Adani Enterprises (ADANIENT),"Stocks to Watch Today, August 1: Infosys, Godrej Prop, Adani Ent, ITC, TaMo",2024-08-01 07:00:00
Adani Enterprises (ADANIENT),"Adani Ent. Adani Wilmar, Adani Power other group stocks gain up to 17%. Adani Power, Ambuja rise to pre Hindenburg level | Stock Market News",2023-12-06 08:00:00
Adani Enterprises (ADANIENT),"Buzzing Stocks: Adani Ent, Infosys, Tata Comm, Vodafone Idea, HDFC Bank, Ambuja Cement, Paytm, Zee and...",2024-04-18 07:00:00
Adani Enterprises (ADANIENT),"Buzzing Stocks: Adani Ent, Anand Rathi, TCS, Aster DM Healthcare, Wipro, IIFL Finance, Rel Power and...",2024-04-15 07:00:00
Adani Enterprises (ADANIENT),Adani Ent: Navi Mumbai airport capacity to peak in Q1FY26,2024-08-05 07:00:00
Adani Enterprises (ADANIENT),Adani enters metal industry as copper unit in Mundra begins operations; Adani Ent stock up 2%,2024-03-28 07:00:00
Adani Enterprises (ADANIENT),Adani Enterprises: Anil Singhvis Bullish Outlook on Adani Ent Futures | Watch Aaj ke 2000,2024-01-09 08:00:00
Adani Enterprises (ADANIENT),Adani Ent board OKs raising Rs 800-cr via NCDs,2024-08-17 07:00:00
Adani Enterprises (ADANIENT),"Adani Group stocks fall amid weak market sentiment; Adani Enterprises, Adani Ports shares top Nifty 50 laggards | Stock Market News",2023-10-23 07:00:00
Adani Enterprises (ADANIENT),"Buzzing Stocks: Adani Ent, Hindustan Unilever, Paytm, IRCTC, Gland Pharma, NMDC and others",2024-02-15 08:00:00
Adani Enterprises (ADANIENT),"Stocks to Watch, April 23: RIL, Paytm, Adani Ent, Patel Engg, Inox Wind",2024-04-23 07:00:00
Adani Enterprises (ADANIENT),Early closure! Adani Enterprises' Rs 800 crore NCD to be closed on... - Important update,2024-09-05 23:11:24
Adani Enterprises (ADANIENT),"Adani Ent’s Dubai arm acquires France-based Le Marche for 5,000 euros",2024-03-06 08:00:00
Adani Enterprises (ADANIENT),"Q3 Results today: Adani Ent, Adani Ports, Bata, Titan, among 87 others to report earnings on the Budget Day",2024-02-01 08:00:00
Adani Enterprises (ADANIENT),Sensex up 186 pts; Adani Ent spurts 6.31%,2024-05-31 07:00:00
Adani Enterprises (ADANIENT),Adani Ent to demerge food-FMCG businesses,2024-08-02 07:00:00
Adani Enterprises (ADANIENT),"Adani Stocks In Focus: Adani Ent., Adani Ports Rally Up To 6%. Here's Why",2024-01-29 08:00:00
Adani Enterprises (ADANIENT),"Adani stocks fire up: Adani Enterprises, Adani Energy, ATGL surge up to 7%",2024-01-29 08:00:00
Adani Enterprises (ADANIENT),"Adani Enterprises Q1 Results Highlights: Net profit rises 115.8% to ₹1,454.5 crore, revenue up 12.4%",2024-08-01 07:00:00
Adani Enterprises (ADANIENT),"Stocks To Watch: Zomato, Paytm, Adani Ent, Wipro, Vi, TCS, Indigo, LIC, And Others",2024-06-18 07:00:00
Adani Enterprises (ADANIENT),"Reliance, Adani Ent, Adani Ports: What Should Investors Do With Adani, Ambani Stocks Before Election Results",2024-05-10 07:00:00
Adani Enterprises (ADANIENT),Adani Ent announces public issuance of secured NCDs to raise up to Rs 800 cr,2024-08-29 13:16:01
Adani Enterprises (ADANIENT),"Reliance biggest wealth creator, Adani Ent top all-round creator: Study",2023-12-17 08:00:00
Adani Enterprises (ADANIENT),Adani Enterprises shares rise 10% amid heavy volumes; Here are the key levels to watch out,2023-11-28 08:00:00
Adani Enterprises (ADANIENT),"Q3 results this week: Bajaj Fin, ITC, L&T, Tata Motors, Adani Enterprises among others to declare earnings. Full lis | Company Business News",2024-01-28 08:00:00
Adani Enterprises (ADANIENT),"Stocks to Watch: Indigo, Adani Ent, HDFC Bank, RIL, Zee Ent, RVNL, and Others",2024-03-11 07:00:00
Adani Enterprises (ADANIENT),"Adani Ent Hits New High, Nears Pre-Hindenburg Level; Adani's Top Stock May Rise By Rs 1,000-1,500 Ahead",2024-02-07 08:00:00
Adani Enterprises (ADANIENT),"Adani Ent arm, Abu Dhabi's IHC subsidiary Sirius form JV to boost India's $175-bn digital transformation",2023-12-28 08:00:00
Adani Enterprises (ADANIENT),"Share Market Highlights 23 May 2024: Sensex, Nifty hit record closing highs; Adani Ent jumps over 8%",2024-05-23 07:00:00
Adani Enterprises (ADANIENT),Adani Group company has good DIVIDEND news for shareholders,2024-05-02 07:00:00
Adani Enterprises (ADANIENT),"Bajaj Auto, Adani Ent top gainers on Nifty50; Adani Ports, HDFC Bank most active on Jan 3",2024-01-03 08:00:00
Adani Enterprises (ADANIENT),"Stocks to Watch: Hero MotoCorp, LIC, Paytm, RVNL, Adani Ent, JSW Steel, and Others",2024-02-19 08:00:00
Adani Enterprises (ADANIENT),"Top 10 stocks to watch on November 2, 2023: Adani Ent, Suzlon Energy, Adani Power, SpiceJet, HUL, TechM and more",2023-11-02 07:00:00
Adani Enterprises (ADANIENT),"Most of Adani Group firms hit lower circuit limit; Adani Ent, Adani Ports dive 25 pc intra-day",2024-06-04 07:00:00
Adani Enterprises (ADANIENT),"Q2 Results today: Tata Motors, Adani Enterprises, Dabur, others to announce Q2 earnings | Company Business News",2023-11-02 07:00:00
Adani Enterprises (ADANIENT),"Adani Ent, L&T, Tata Motors among top 10 stocks that led Nifty 50's near 1,000-point fall in 6 sessions | Stock Market News",2023-10-26 07:00:00
Adani Enterprises (ADANIENT),"Stocks to Watch on Jan 18: HDFC Bank, NHPC, Adani Ent, IndusInd Bank, BEL",2024-01-18 08:00:00
Adani Enterprises (ADANIENT),"Adani Enterprises Share Price: Stock Jumps 8 pc, Reaches One-Year High",2024-05-23 07:00:00
Adani Enterprises (ADANIENT),"BSE Indices Rejig: Not Adani Ent But This Adani Stock To Replace Wipro On Sensex; REC, Canara, Trent Shuffled",2024-05-25 07:00:00
Adani Enterprises (ADANIENT),"Buzzing Stocks: IIFL Finance, Tata Motors, Asian Paints, Adani Ent, M&M, Zomato and others in news",2024-03-07 08:00:00
Adani Enterprises (ADANIENT),"Stocks To Watch: ITC, Tata Motors, Zomato, Adani Ent, Infosys, Bharat Forge, And Others",2024-08-01 07:00:00
Adani Enterprises (ADANIENT),"Stocks to Watch: Wipro, RVNL, Federal Bank, Adani Ent, Godrej, Coal India, and Others",2024-05-02 07:00:00
Adani Enterprises (ADANIENT),"Buzzing Stocks: RVNL, IndiGo, Vodafone Idea, GAIL, Adani Ent, M&M, BSE and others in news",2024-03-11 07:00:00
Adani Enterprises (ADANIENT),"Adani Ent, Other Adani Stocks In Focus: Group To Tap Copper Industry With $1.2 Billion Plan",2024-03-01 08:00:00
Adani Enterprises (ADANIENT),Adani Ent raises ₹700 cr via NCDs; stock surges,2023-10-12 07:00:00
Adani Enterprises (ADANIENT),"Adani Stocks Buzz: Why NDTV, Adani Ent Shares Will Be In Focus This Week Over 50% Stake Acquisition In IANS?",2023-12-17 08:00:00
Adani Enterprises (ADANIENT),"Adani Ent, Bajaj Fin among 54 stocks that gave Hockey-stick returns of over 25% in 10 years",2023-12-14 08:00:00
Adani Enterprises (ADANIENT),Adani-Hindenburg Case: Supreme Court defers hearing till October 20; stocks trade lower | Stock Market News,2023-10-13 07:00:00
Adani Enterprises (ADANIENT),"Adani Ent, Adani Ports: What's Brewing In Adani Shares? Group To Invest Rs 62,400 Crore In Big Projects",2024-01-19 08:00:00
Adani Enterprises (ADANIENT),Adani Ent stock up as Abu Dhabi-based IHC raises stake to above 5%,2023-10-04 07:00:00
Adani Enterprises (ADANIENT),"Adani Ent, Adani Green, Adani Power: Adani Group Shares Trade In Green As SC Hears Adani Hindenburg Case",2023-11-24 08:00:00
Adani Enterprises (ADANIENT),"Adani Ent, Adani Ports Escape Bears, 5 Adani Shares Shed 3-10%: Why Gautam Adani-Led Stocks Are Falling?",2023-12-13 08:00:00
Adani Enterprises (ADANIENT),"Stocks to Watch: SBI, SpiceJet, Coal India, IRCTC, Airtel, Adani Ent, and Others",2023-11-21 08:00:00
Adani Enterprises (ADANIENT),"Adani Enterprises Q4 Results Highlights: Net profit falls 39% to ₹449 crore, ₹1.3 dividend announced",2024-05-02 07:00:00
Adani Enterprises (ADANIENT),"Stocks to Watch: Adani Ent, Tata Motors, SBI, BPCL, Tata Steel, Britannia, and Others",2023-11-02 07:00:00
Adani Enterprises (ADANIENT),"If You Invested ₹10,000 In Adani Ent When Modi Came To Power, Here's How Much You'd Have Today",2023-07-04 07:00:00
Adani Enterprises (ADANIENT),"Adani Ent share price Today Live Updates : Adani Ent closed today at ₹2455.7, down -3.26% from yesterday's ₹2538.45 | Stock Market News",2023-08-14 07:00:00
Adani Enterprises (ADANIENT),"Adani Ent share price Today Live Updates : Adani Ent closed today at ₹2530.1, down -6.21% from yesterday's ₹2697.7 | Stock Market News",2023-08-23 07:00:00
Adani Enterprises (ADANIENT),Adani Enterprises (NSE: ADANIENT) down 3% today - still not recovering from Hindenberg,2023-08-08 07:00:00
Adani Enterprises (ADANIENT),"Adani Enterprises Shares Shine, Hit Upper Circuit After US Agency Finds Hindenburg's Accusations 'Irrelevant'",2023-12-05 08:00:00
Adani Enterprises (ADANIENT),"Adani Enterprises Q1 results: Net profit grows 44% to ₹674 crore, revenue falls 38% | Company Business News",2023-08-03 07:00:00
Adani Enterprises (ADANIENT),"Q1 results today: Adani Enterprises, Tata Motors, ITC, Sun Pharma, Zomato, others to post earnings on August 1; check list",2024-07-31 07:00:00
Adani Enterprises (ADANIENT),"Adani News Live: Adani group stocks fall; Adani Ent, Adani Ports, Adani Wilmar down up to 1-3% | Company Business News",2023-09-01 07:00:00
Adani Enterprises (ADANIENT),Two traders built big Adani Ent positions as GQG stepped in | Stock Market News,2023-03-06 08:00:00
Asian Paints (ASIANPAINT),"‘I sold Asian Paints after bad results and market proved me wrong’, says Reddit user; should investors buy now? | Stock Market News",2024-07-18 07:00:00
Asian Paints (ASIANPAINT),It's Probably Less Likely That Asian Paints Limited's (NSE:ASIANPAINT) CEO Will See A Huge Pay Rise This Year,2024-06-19 07:00:00
Asian Paints (ASIANPAINT),Asian Paints Near Nil Returns — Is There A Silver Lining?,2024-04-08 07:00:00
Asian Paints (ASIANPAINT),"Analysts sour on Asian Paints as competition, demand fears paint gloomy picture",2024-06-07 07:00:00
Asian Paints (ASIANPAINT),Paint companies Asian Paints and Berger Paints start hiking prices,2024-07-10 07:00:00
Asian Paints (ASIANPAINT),"Asian Paints Q1 results: Net profit falls 24.5% on weak demand, price cuts",2024-07-17 07:00:00
Asian Paints (ASIANPAINT),Here's why Abneesh Roy is bullish on Asian Paints and Berger,2024-07-11 07:00:00
Asian Paints (ASIANPAINT),Stagnant Asian Paints now attracts bulls,2024-07-15 07:00:00
Asian Paints (ASIANPAINT),private companies who own 39% along with institutions invested in Asian Paints Limited (NSE:ASIANPAINT) saw increase in their holdings value last week,2024-09-09 00:19:09
Asian Paints (ASIANPAINT),Ganesh Chaturthi pick: Sumeet Bagadia suggests this paint stock to buy | Stock Market News,2024-09-06 07:00:00
Asian Paints (ASIANPAINT),"Asian Paints Q1 Results: Cons PAT drops 24% YoY to Rs 1,170 crore; misses estimates",2024-07-17 07:00:00
Asian Paints (ASIANPAINT),Asian Paints Limited's (NSE:ASIANPAINT) Popularity With Investors Is Under Threat From Overpricing,2024-04-09 07:00:00
Asian Paints (ASIANPAINT),"Asian paints share price: Should you Buy, Sell Or Hold the stock post price hike undertaken by paint majors? | Stock Market News",2024-07-11 07:00:00
Asian Paints (ASIANPAINT),Those who invested in Asian Paints (NSE:ASIANPAINT) five years ago are up 105%,2024-03-06 08:00:00
Asian Paints (ASIANPAINT),"Asian Paints Q1 Results: Net profit drops 24% to ₹1,170 crore, decorative biz volume up 7%; Revenue down 2.3% YoY | Company Business News",2024-07-17 07:00:00
Asian Paints (ASIANPAINT),Asian Paints Limited Just Missed Earnings - But Analysts Have Updated Their Models,2024-07-20 07:00:00
Asian Paints (ASIANPAINT),Asian Paints' (NSE:ASIANPAINT) Shareholders Will Receive A Bigger Dividend Than Last Year,2024-06-05 07:00:00
Asian Paints (ASIANPAINT),Institutions own 24% of Asian Paints Limited (NSE:ASIANPAINT) shares but private companies control 40% of the company,2024-02-04 08:00:00
Asian Paints (ASIANPAINT),"With EPS Growth And More, Asian Paints (NSE:ASIANPAINT) Makes An Interesting Case",2024-08-22 07:00:00
Asian Paints (ASIANPAINT),We Think Asian Paints (NSE:ASIANPAINT) Can Manage Its Debt With Ease,2024-01-16 08:00:00
Asian Paints (ASIANPAINT),"Asian Paints Q1 FY25 results: Profit down 25% at Rs 1,170 crore; revenue slips 2%",2024-07-17 07:00:00
Asian Paints (ASIANPAINT),Paint companies Asian Paints and Berger Paints start slashing prices,2024-05-17 07:00:00
Asian Paints (ASIANPAINT),"Asian Paints, rival Berger hike prices across portfolio, shares upbeat",2024-07-10 07:00:00
Asian Paints (ASIANPAINT),"Will Asian Paints stock fall after Q1 show? Goldman Sachs, others share views, price targets",2024-07-18 07:00:00
Asian Paints (ASIANPAINT),"Asian Paints Q4 Results: Net profit up 1.3% to ₹1,275 crore, revenue drops marginally; dividend declared",2024-05-09 07:00:00
