topic,headline,time
Infosys (INFY),"INFY Expands Client Base: Should You Buy, Hold or Sell the Stock?",2024-09-09 07:00:00
Infosys (INFY),Infosys Limited (NYSE:INFY) Q4 2024 Earnings Call Transcript,2024-04-19 07:00:00
Infosys (INFY),Infosys Joins Stanford HAI Affiliate Program to Accelerate Enterprise AI Research Initiatives,2024-08-28 10:21:00
Infosys (INFY),Infosys (INFY) to Report Q4 Earnings: What's in the Cards?,2024-04-15 07:00:00
Infosys (INFY),Infosys to Accelerate Yunex Traffic's ERP Transformation,2024-05-08 07:00:00
Infosys (INFY),Infosys (NYSE:INFY) Stock Rating Upgraded by Erste Group Bank,2024-09-12 02:03:47
Infosys (INFY),Infosys and The Financial Times Unveil the 'FT Money Machine' Through Immersive Extended Reality Experience,2024-09-06 07:00:00
Infosys (INFY),"Launched today: Infosys Aster™ - The AI-amplified marketing suite that delivers engaging brand experiences, enhanced marketing efficiency, and accelerated business growth",2024-06-18 07:00:00
Infosys (INFY),INFY Earnings: Infosys reports higher revenue and profit for Q1 2025,2024-07-18 07:00:00
Infosys (INFY),Why Infosys Stock Just Jumped 9%,2024-07-18 07:00:00
Infosys (INFY),India's Infosys raises annual sales forecast as IT demand returns,2024-07-18 07:00:00
Infosys (INFY),"Infosys: Stellar all round performance with 3.6% sequential revenue growth in cc, 1% operating margin expansion",2024-07-18 07:00:00
Infosys (INFY),Infosys (INFY) Q4 Earnings and Revenues Surpass Estimates,2024-04-19 07:00:00
Infosys (INFY),Infosys Topaz and Intel Collaborate to Accelerate Enterprise Growth and Efficiency with Generative AI,2024-04-10 07:00:00
Infosys (INFY),Infosys Collaborates with Sector Alarm to Fuel Growth through Cloud-based Microsoft Dynamics ERP,2024-07-09 07:00:00
Infosys (INFY),Infosys and ServiceNow Expand AI Collaboration to Revolutionize Service Delivery,2024-08-01 07:00:00
Infosys (INFY),Infosys a Top 100 most valuable brand in the world by Kantar BrandZ; Ranked among the most-trusted brands in India and the US,2024-06-12 07:00:00
Infosys (INFY),Infosys: Growth Is At The Inflection Point,2024-07-24 07:00:00
Infosys (INFY),Infosys Collaborates with TDC Net to Accelerate Digital Transformation,2024-07-30 07:00:00
Infosys (INFY),Zand Bank Subscribes to Infosys Finacle's Corporate Banking Suite on Microsoft Cloud to Deliver New-Age Banking Experiences,2024-04-03 07:00:00
Infosys (INFY),Infosys and Formula E Strike New Partnership to Enable Next-Gen Fan Experiences Powered by AI and Digital Innovations,2024-05-09 07:00:00
Infosys (INFY),"After $4 bln Infosys demand, India may target other IT majors, source says",2024-08-01 07:00:00
Infosys (INFY),Infosys Collaborates with Telstra for AI-led Engineering Transformation,2024-05-16 07:00:00
Infosys (INFY),"India will not relax its tax demand on Infosys, source says",2024-08-05 07:00:00
Infosys (INFY),Infosys Gushes Free Cash Flow Based on AI - INFY Stock Looks Cheap to Value Investors,2024-07-22 07:00:00
Infosys (INFY),Infosys and Handelsblatt Media Group Announce Strategic Collaboration,2024-03-27 07:00:00
Infosys (INFY),INFY Earnings: Highlights of Infosys’ Q4 2024 financial report,2024-04-18 07:00:00
Infosys (INFY),Infosys Ltd's Dividend Analysis,2024-05-31 07:00:00
Infosys (INFY),Infosys (INFY) Falls After $1.5B Global AI Deal Termination,2023-12-27 08:00:00
Infosys (INFY),Does the Infosys Stock Rally Have More in the Tank?,2024-07-30 07:00:00
Infosys (INFY),Infosys Falls After Reporting Results—Here's Why,2024-04-18 07:00:00
Infosys (INFY),Infosys: Strong large deal TCV of $4.5 billion in Q4 and record $17.7 billion in FY24 create robust foundation for growth,2024-04-18 07:00:00
Infosys (INFY),Cognizant files lawsuit against Infosys over trade secrets; Infy denies allegations | Company Business News,2024-08-24 07:00:00
Infosys (INFY),"Infosys to Acquire Leading Engineering R&D services provider, in-tech",2024-04-18 07:00:00
Infosys (INFY),Infosys Limited (NYSE:INFY) Q1 2025 Earnings Call Transcript,2024-07-20 07:00:00
Infosys (INFY),Caprock Group LLC Grows Stake in Infosys Limited (NYSE:INFY),2024-09-10 10:06:52
Infosys (INFY),"Game, Set, AI: Infosys Brings Advanced AI-led Innovations to Roland-Garros 2024",2024-05-29 07:00:00
Infosys (INFY),Infosys Celebrates 25 Years of Delivering Innovation with SAP,2024-02-01 08:00:00
Infosys (INFY),Stocks To Watch: Infosys ADR Sees RS Rating Rise To 88,2024-07-19 07:00:00
Infosys (INFY),Infosys Collaborates with Pacific International Lines to Drive Digital Transformation in Logistics Industry,2024-02-13 08:00:00
Infosys (INFY),Investors Don't See Light At End Of Infosys Limited's (NSE:INFY) Tunnel,2024-09-07 02:27:16
Infosys (INFY),Ethisphere recognizes Infosys among 2024 World's Most Ethical Companies® for the Fourth Consecutive Year,2024-03-04 08:00:00
Infosys (INFY),"Infosys and ATP Renew Partnership until 2026, to Drive AI-first Innovations in Professional Tennis",2024-03-06 08:00:00
Infosys (INFY),"Infosys Topaz Unveils Responsible AI Suite of Offerings, to help Enterprises Navigate the Regulatory and Ethical Complexities of AI-powered Transformation",2024-02-27 08:00:00
Infosys (INFY),Cognizant files lawsuit against Infosys over trade secrets; Infy denies,2024-08-24 07:00:00
Infosys (INFY),Infosys' (INFY) Topaz Accelerates Spotlight's Customer Growth,2023-12-06 08:00:00
Infosys (INFY),Panagora Asset Management Inc. Raises Stock Position in Infosys Limited (NYSE:INFY),2024-08-30 07:00:00
Infosys (INFY),Infosys: This Pullback Can Set Up For A Move Much Higher (Technical Analysis) (NYSE:INFY),2024-04-02 07:00:00
Infosys (INFY),"Infosys share: Can Infy deliver TCS, HCL Tech like Q1 results today? | Stock Market News",2024-07-18 07:00:00
Infosys (INFY),India's Infosys falls as annual revenue outlook disappoints,2024-04-18 07:00:00
Infosys (INFY),Infosys (NYSE:INFY) Hits New 52-Week High at $23.14,2024-08-28 07:00:00
Infosys (INFY),Infosys Collaborates with First Abu Dhabi Bank to Optimize and Modernize its IT Infrastructure Services,2024-05-14 07:00:00
Infosys (INFY),India's Infosys falls after $1.5 billion AI deal termination,2023-12-26 08:00:00
Infosys (INFY),Earnings: A snapshot of Infosys’ Q3 2024 financial report,2024-01-11 08:00:00
Infosys (INFY),Infosys Shareholders | Who Owns The Most Shares of Infosys?,2024-04-29 07:00:00
Infosys (INFY),"MakerspaceCT Awarded $10,000 “Infy Makers Award” from Infosys Foundation USA",2024-01-17 08:00:00
Infosys (INFY),There's No Escaping Infosys Limited's (NSE:INFY) Muted Earnings,2024-03-26 07:00:00
Infosys (INFY),"Jefferies ups Infosys shares target, highlights recovery and 10% EPS growth forecast",2024-07-19 07:00:00
Infosys (INFY),Infosys Limited (NYSE:INFY) Shares Sold by Nordea Investment Management AB,2024-07-09 07:00:00
Infosys (INFY),Infosys stock target raised on strong quarter,2024-07-19 07:00:00
Infosys (INFY),"India's Infosys CFO Nilanjan Roy resigns, Jayesh Sanghrajka to succeed",2023-12-11 08:00:00
Infosys (INFY),Infosys: Quality Large-Cap Levered To An IT Spending Recovery (NYSE:INFY),2024-01-18 08:00:00
Infosys (INFY),"Insiders At Infosys Sold US$5.4b In Stock, Alluding To Potential Weakness",2024-07-15 07:00:00
Infosys (INFY),Here's Why We Think Infosys (NSE:INFY) Might Deserve Your Attention Today,2024-05-29 07:00:00
Infosys (INFY),Infosys Brings AI-First Technologies to Centre Court for a More Immersive Australian Open 2024 Experience,2024-01-24 08:00:00
Infosys (INFY),Infosys Limited (NSE:INFY) Stock's Been Sliding But Fundamentals Look Decent: Will The Market Correct The Share Price In The Future?,2024-04-13 07:00:00
Infosys (INFY),"With 55% institutional ownership, Infosys Limited (NSE:INFY) is a favorite amongst the big guns",2024-05-08 07:00:00
Infosys (INFY),Infosys (NSE:INFY) Is Increasing Its Dividend To $28.00,2024-05-14 07:00:00
Infosys (INFY),Infosys and Better collaborate to offer Mortgage as a Service,2023-11-09 08:00:00
Infosys (INFY),Why Infosys stock could surge in near term - Morgan Stanley,2024-03-29 07:00:00
Infosys (INFY),Unveiling Infosys (INFY)'s Value: Is It Really Priced Right? A Comprehensive Guide,2023-10-12 07:00:00
Infosys (INFY),Infy wins $100mn Ikea deal,2024-06-15 07:00:00
Infosys (INFY),Results: Infosys Limited Exceeded Expectations And The Consensus Has Updated Its Estimates,2024-04-21 07:00:00
Infosys (INFY),Infosys’s bumper dividend will fetch Narayana Murthy’s grandkid 4.2 crore,2024-04-20 07:00:00
Infosys (INFY),INFY Earnings: Highlights of Infosys’ Q2 2024 financial results,2023-10-12 07:00:00
Infosys (INFY),"Infosys shares fall, raising demand worries for Indian IT sector",2023-10-12 07:00:00
Infosys (INFY),"Infosys Share Price Today Highlights, 06 Sep, 2024: Infy stock down 1.2% as govt mulls actions against it",2024-09-06 07:00:00
Infosys (INFY),"Infosys to get over Rs 6,000 crore in tax refund for 11 years",2024-04-01 07:00:00
JSW Steel (JSWSTEEL),JSW Steel Limited (NSE:JSWSTEEL) Might Not Be As Mispriced As It Looks,2024-09-14 02:32:20
JSW Steel (JSWSTEEL),These 4 Measures Indicate That JSW Steel (NSE:JSWSTEEL) Is Using Debt Reasonably Well,2024-07-20 07:00:00
JSW Steel (JSWSTEEL),JSWSTEEL Outlook for the Week,2024-09-06 07:00:00
JSW Steel (JSWSTEEL),JSW Steel picks Robert Simon as CEO for its American operations,2024-03-06 08:00:00
JSW Steel (JSWSTEEL),"Private companies among JSW Steel Limited's (NSE:JSWSTEEL) largest shareholders, saw gain in holdings value after stock jumped 5.0% last week",2024-08-27 00:26:29
JSW Steel (JSWSTEEL),"JSW Steel Q4 Results Highlights: Net profit down 64% YoY at ₹1,322 crore, dividend declared",2024-05-17 07:00:00
JSW Steel (JSWSTEEL),JSW Steel Ltd - JSWSTEEL Share Price Live Today,2024-07-29 11:17:09
JSW Steel (JSWSTEEL),"Stocks to buy: JSW Steel, Vedanta, IndiGo, Tata Consumer Products among analysts' top picks",2024-08-22 07:00:00
JSW Steel (JSWSTEEL),"Jsw Steel Outlook for the Week (June 03, 2024 – June 07, 2024)",2024-05-31 07:00:00
JSW Steel (JSWSTEEL),"JSW Steel joins hand with Japan's JFE Steel for steel plant in Karnataka, stock falls marginally",2024-02-13 08:00:00
JSW Steel (JSWSTEEL),JSW Steel Limited (NSE:JSWSTEEL) Doing What It Can To Lift Shares,2024-05-04 07:00:00
JSW Steel (JSWSTEEL),JSW Steel up 1.2% after company reports 12.66% growth in consolidated crude steel production in July,2024-08-09 07:00:00
JSW Steel (JSWSTEEL),"Stocks to buy, sell: Tata Motors, Oracle Financial, UPL, MCX among analysts' top picks",2024-07-25 07:00:00
JSW Steel (JSWSTEEL),JSW Steel's (NSE:JSWSTEEL) Upcoming Dividend Will Be Larger Than Last Year's,2024-07-03 07:00:00
JSW Steel (JSWSTEEL),"JSW Steel's Q3 net profit jumps five-fold to Rs 2,415 cr on strong demand",2024-01-25 08:00:00
JSW Steel (JSWSTEEL),Investors Could Be Concerned With JSW Steel's (NSE:JSWSTEEL) Returns On Capital,2024-04-16 07:00:00
JSW Steel (JSWSTEEL),"JSW Steel reports 4% YoY drop in May crude steel production, shares trade lower",2024-06-10 07:00:00
JSW Steel (JSWSTEEL),"JSW Steel First Quarter 2025 Earnings: Revenues Beat Expectations, EPS Lags",2024-07-21 07:00:00
JSW Steel (JSWSTEEL),JSW Steel Limited Just Missed Earnings - But Analysts Have Updated Their Models,2024-07-22 07:00:00
JSW Steel (JSWSTEEL),JSW Steel (NSE:JSWSTEEL) shareholders have earned a 27% CAGR over the last five years,2024-02-12 08:00:00
JSW Steel (JSWSTEEL),"Q1 results today: Reliance, Wipro, BPCL, Paytm, JSW Steel, others to post earnings on July 19; check list",2024-07-19 02:42:26
JSW Steel (JSWSTEEL),"JSW Steel Q1 Results: Profit falls 64% YoY to Rs 845 crore, misses estimates",2024-07-19 07:00:00
JSW Steel (JSWSTEEL),"Tata Steel, JSW Steel Downgraded To Sell By CLSA Despite Strong Volume Growth",2024-03-04 08:00:00
JSW Steel (JSWSTEEL),"JSW Steel Q1 Results: Profit Falls 64.3%, Misses Estimates",2024-07-19 07:00:00
JSW Steel (JSWSTEEL),"JSW Steel, Inox Wind, Infosys: Trading strategies for these 3 buzzing stocks",2024-06-11 07:00:00
JSW Steel (JSWSTEEL),Top 20 Steel Companies In World,2023-07-10 07:00:00
JSW Steel (JSWSTEEL),"JSW Steel shares headed toward record high, top Sensex gainer today; key details",2024-02-21 08:00:00
JSW Steel (JSWSTEEL),"JSW Steel records highest ever annual output, stock trading flat",2024-04-08 07:00:00
JSW Steel (JSWSTEEL),"JSW Energy, JSW Infra, JSW Steel shares in focus amid rape charges against Sajjan Jindal",2023-12-18 08:00:00
JSW Steel (JSWSTEEL),"Bullhorn and bear ear stocks: Expert advices 3 names to buy, 2 to sell | Stock Market News",2023-07-30 07:00:00
JSW Steel (JSWSTEEL),JSW Steel USA ties-up $182 million for plant modernisation,2022-10-27 07:00:00
JSW Steel (JSWSTEEL),"Jsw Steel Outlook for the Week (May 06, 2024 – May 10, 2024)",2024-05-03 07:00:00
JSW Steel (JSWSTEEL),"Jsw Steel Outlook for the Week (May 20, 2024 – May 24, 2024)",2024-05-17 07:00:00
JSW Steel (JSWSTEEL),"Jsw Steel Outlook for the Week (May 27, 2024 – May 31, 2024)",2024-05-24 07:00:00
JSW Steel (JSWSTEEL),"JSW Steel Ltd Share Price Today, JSWSTEEL Share Price NSE, BSE",2023-01-23 12:24:17
JSW Steel (JSWSTEEL),JSW Steel shares rise after three sessions; here’s why,2023-05-10 07:00:00
JSW Steel (JSWSTEEL),"JSW Steel, JSPL, Shyam Metalics: What ICICI Securities says on steel stocks",2024-06-25 07:00:00
JSW Steel (JSWSTEEL),"JSW Steel shares clocked flat returns in six months; can they cross Rs 1,000 mark?",2024-01-12 08:00:00
JSW Steel (JSWSTEEL),"JSW Steel shares shed multibagger tag; time to buy, sell or hold?",2023-03-22 07:00:00
JSW Steel (JSWSTEEL),"JSW Steel: After flat returns in 2023, is the metal stock set for a rebound post Q2 earnings?",2023-10-25 07:00:00
JSW Steel (JSWSTEEL),"UltraTech Cement, JSW Steel, ACC & Mankind: 4 largecap stocks SMC Global suggest to buy",2024-05-27 07:00:00
JSW Steel (JSWSTEEL),"Tata Steel, JSW Steel, NMDC, MOIL: Mining shares tumble as SC allows states to levy tax retrospectively",2024-08-13 07:00:00
JSW Steel (JSWSTEEL),"Emami, Tata Consumer, JSW Steel & SAIL: What Kkunal V Parar of Choice Broking says on these 4 stocks",2024-05-23 07:00:00
JSW Steel (JSWSTEEL),"JSW Steel, Reliance Industries and Bharti Airtel scale to fresh 52-week high",2024-06-28 07:00:00
JSW Steel (JSWSTEEL),"NIFTY50 and SENSEX erase early gains to close marginally higher, Realty stock zoom; Stock Market Highlights",2024-01-09 08:00:00
JSW Steel (JSWSTEEL),JSW Steel Ltd Stock Price: JSW Steel Share Price Today,2021-06-25 04:20:13
JSW Steel (JSWSTEEL),"Q2 results calendar: TCS, Infosys, HCL Tech, Tech Mahindra, other blue-chip firms to announce earnings on...",2023-10-02 07:00:00
JSW Steel (JSWSTEEL),"Q1 Results Schedule: TCS, HCL Tech, ICICI Bank, other blue-chip firms will announce earnings on these dates",2023-07-06 07:00:00
Larsen & Toubro (LT),"Connolly, Wild, Larsen, DeLauro Introduce Comprehensive Bill to Protect, Expand Access to IVF",2024-09-17 17:02:57
Larsen & Toubro (LT),Ripple’s Chris Larsen leads $10m investment in Yellow Network,2024-09-17 17:03:44
Larsen & Toubro (LT),Elsie Larsen Game Report: @ Aurora,2024-09-18 08:11:47
Larsen & Toubro (LT),XRP News Today: Chris Larsen’s XRP Transfer Sparks Investor Concerns Amid SEC Uncertainty,2024-09-18 01:34:00
Larsen & Toubro (LT),Ripple Co-Founder Chris Larsen Leads $10 Million Round for DeFi Protocol Yellow Network,2024-09-17 15:06:22
Larsen & Toubro (LT),Ripple Shockwave: Chris Larsen’s $29M XRP Transfer Market Concerns,2024-09-17 22:08:13
Larsen & Toubro (LT),Ripple News: Chris Larsen Shocks Market with $29M Transfer! Sell-Off Incoming?,2024-09-17 16:53:00
Larsen & Toubro (LT),David Edward Larsen Obituary 2024 - Russon Mortuary & Crematory,2024-09-07 07:00:00
Larsen & Toubro (LT),Scholar of the Week: Twin Falls High School's Mollie Larsen,2024-09-17 17:30:00
Larsen & Toubro (LT),50 Million XRP Moved From Ripple Co-Founder Chris Larsen to Unknown Wallet,2024-09-18 05:43:09
Larsen & Toubro (LT),Ripple’s Chris Larsen Transfers 50M XRP After 11 Years of Inactivity,2024-09-17 11:39:53
Larsen & Toubro (LT),Jason Larsen Obituary 2024,2024-08-23 07:00:00
Larsen & Toubro (LT),Massive 50M XRP Shifted By Ripple Chairman After 11 Good Years,2024-09-17 14:25:00
Larsen & Toubro (LT),"Yellow Network, a Web3 Clearing Protocol for Digital Assets, Raises $10M Seed Funding Led by Chris Larsen",2024-09-17 15:00:00
Larsen & Toubro (LT),Ripple’s Chris Larsen Takes Lead in $10M Funding for DeFi Protocol,2024-09-17 17:31:48
Larsen & Toubro (LT),"New Max Larsen Principal hired, Jill Hardway starts new job on Thursday",2024-09-16 13:34:08
Larsen & Toubro (LT),Larsen & Toubro outperforms market on strong trading day,2024-09-16 10:32:00
Larsen & Toubro (LT),Ripple co-founder leads $10M raise for decentralized clearing,2024-09-17 15:01:49
Larsen & Toubro (LT),Provo neighbors frustrated after pattern of crashes,2024-09-17 03:48:04
Larsen & Toubro (LT),Lasse Krogh Johannsen on the New Larsen Strings Aurora Set for Viola,2024-09-17 02:37:30
Larsen & Toubro (LT),"Larsen Strings Launches New ""Aurora"" Viola String Set",2024-09-16 23:22:46
Larsen & Toubro (LT),Michael Edward Larsen Obituary 2024,2024-06-07 07:00:00
Larsen & Toubro (LT),"Obituary | Dale J Larsen of Rigby, Idaho",2024-07-11 07:00:00
Larsen & Toubro (LT),In Conversation with Chris Larsen,2024-05-21 21:20:34
Larsen & Toubro (LT),Lidewij Edelkoort To Be Honored With Inaugural Larsen Textile Award At LongHouse Reserve,2024-09-16 16:52:55
Larsen & Toubro (LT),"Chris Larsen Transfers 50,000,000 XRP to an Unknown Wallet",2024-09-17 11:06:29
Larsen & Toubro (LT),Obituary | Ryan Larsen,2024-06-24 23:29:05
Larsen & Toubro (LT),Ripple Chairman Chris Larsen Moves 50M XRP for the First Time in 11 Years,2024-09-17 05:09:49
Larsen & Toubro (LT),Emporium brings artisanry back to Dannebrog after flood of 2019,2024-09-16 17:46:00
Larsen & Toubro (LT),"""Architecture as a Canvas to Shape Life:"" In Conversation with Sigurd Larsen",2024-09-13 09:30:00
Larsen & Toubro (LT),Mark Daniel Larsen,2024-04-08 07:00:00
Larsen & Toubro (LT),2024 Storm Lucky Larsen - Statistics,2024-08-24 16:17:43
Larsen & Toubro (LT),Stewart Larsen Obituary 2024,2024-03-24 07:00:00
Larsen & Toubro (LT),A daring holdup in Ocean Grove: From the Asbury Park Press archives,2024-09-14 09:03:03
Larsen & Toubro (LT),Elias Larsen Miller Obituary 2024 - Russon Mortuary & Crematory,2024-05-26 07:00:00
Larsen & Toubro (LT),"Obituary information for Gerald Norman ""Jerry"" Larsen",2024-07-09 07:00:00
Larsen & Toubro (LT),Twin Falls High School's Mollie Larsen,2024-09-16 20:24:00
Larsen & Toubro (LT),Florence Lorena Larsen - View Obituary & Service Information,2024-08-02 07:00:00
Larsen & Toubro (LT),Bernie Larsen,2024-08-14 00:38:52
Larsen & Toubro (LT),"Obituary | JoAnne Larsen Ames of Ucon, Idaho",2024-06-09 07:00:00
Larsen & Toubro (LT),Donald Larsen Obituary 2024,2024-06-15 07:00:00
Larsen & Toubro (LT),"Chris Larsen Leads $10M Investment Round in Yellow Network, Pushing Crypto Trading Innovation",2024-09-17 15:10:16
Larsen & Toubro (LT),Larsen Applauds Passage of FAA Reauthorization Bill,2024-05-15 07:00:00
Larsen & Toubro (LT),"Julie Ann Larsen Obituary (2024) - Peshtigo, WI - Berth and Rosenthal Funeral Home",2024-07-08 07:00:00
Larsen & Toubro (LT),Sheril Nathan Larsen,2024-03-29 07:00:00
Larsen & Toubro (LT),"Larsen Supports Israel’s Defense, Aid for Gaza",2024-04-20 07:00:00
Larsen & Toubro (LT),Larsen Secures $19.3 Million for Fifteen Local Projects in Fiscal Year 2024 Spending Package,2024-03-08 08:00:00
Larsen & Toubro (LT),Larsen Secures $17.9 Million for Port of Bellingham’s Shipping Terminal Rail Connection Project,2024-06-26 07:00:00
Larsen & Toubro (LT),"Donald Larsen Obituary (2024) - Richfield, OH",2024-04-12 16:13:26
Larsen & Toubro (LT),"Obituary | Marion W. Larsen of New Braunfels, Texas",2024-07-11 07:00:00
Larsen & Toubro (LT),"For Trailblazing BMX Racer Kamren Larsen, The Operative Word Is ‘Legacy’",2024-06-17 07:00:00
Larsen & Toubro (LT),Retirement reception for Dr. Larsen set for June 26,2024-06-19 07:00:00
Larsen & Toubro (LT),Larsen Requests More Than $42 Million for 15 Local Projects in Fiscal Year 2025 Spending Bill,2024-05-22 07:00:00
Larsen & Toubro (LT),"Betty Larsen Obituary (1930 - 2024) - Holladay, UT - Deseret News",2024-07-30 07:00:00
Larsen & Toubro (LT),"Elizabeth ""Biss"" Ann Larsen",2024-08-19 16:55:19
Larsen & Toubro (LT),Vivian A Larsen Obituary 2024,2024-01-19 08:00:00
Larsen & Toubro (LT),Relativity Welcomes Kirk Larsen as Chief Financial Officer,2024-04-04 07:00:00
Larsen & Toubro (LT),Larsen Justice Fellowship Program,2024-02-27 19:37:25
Larsen & Toubro (LT),"U.S. Travel Joins Rep. Larsen for “Travel Works” Power Hour in Bellingham, WA",2024-06-24 07:00:00
Larsen & Toubro (LT),Bridgett Ann (Wright) Larsen Obituary 2024,2024-03-18 07:00:00
Larsen & Toubro (LT),"Steven Larsen Obituary (1960 - 2024) - North Platte, NE - York News-Times",2024-04-01 22:40:13
Larsen & Toubro (LT),"9-13-24 – Porter Larsen on Isaac Wilson’s opportunity at QB, Utah vs. State, and more!",2024-09-14 18:41:48
Larsen & Toubro (LT),Kenneth Richard Larsen Obituary 2024,2024-02-23 08:00:00
Larsen & Toubro (LT),High-resolution elevation models of Larsen B glaciers extracted from 1960s imagery | Scientific Reports,2024-07-08 07:00:00
Larsen & Toubro (LT),Carla Donn (Fikstad) Larsen Buchi Obituary 2024,2024-02-24 08:00:00
Larsen & Toubro (LT),Ronald Larsen Obituary 2024,2024-04-08 07:00:00
Larsen & Toubro (LT),Wolves complete loan signing of striker Jorgen Strand Larsen from Celta Vigo - The Athletic,2024-07-02 07:00:00
Larsen & Toubro (LT),Elizabeth Diane Larsen Obituary 2024,2024-01-31 08:00:00
Larsen & Toubro (LT),Joachim Larsen Tegner,2024-07-07 16:41:01
Larsen & Toubro (LT),Ripple Chairman moves 50 million XRP to new address in first notable transfer since 2013,2024-09-16 17:51:26
Larsen & Toubro (LT),Larsen Releases Report to Combat Opioid Epidemic in Northwest Washington,2024-01-25 08:00:00
Larsen & Toubro (LT),Poul Larsen Obituary 2023,2023-11-24 08:00:00
Larsen & Toubro (LT),Jorgen Strand Larsen to Wolves: The Athletic 500 transfer ratings,2024-07-04 07:00:00
Larsen & Toubro (LT),Seven hopefuls tee up against incumbent Larsen in U.S. District 2 race,2024-07-04 07:00:00
Larsen & Toubro (LT),Missoula Hellgate's Chloe Larsen commits to Montana Lady Griz,2024-05-14 07:00:00
Larsen & Toubro (LT),Man vs. trees: How a rancher’s bulldozing project cost Utah taxpayers,2024-09-10 09:03:01
Larsen & Toubro (LT),Way Too Early NFL Draft Preview For Utah State’s Ike Larsen,2024-04-26 07:00:00
Larsen & Toubro (LT),Remembering the life of Paul Larsen,2024-09-08 11:11:20
Larsen & Toubro (LT),Marilyn Larsen Obituary 2024,2024-02-22 08:00:00
Larsen & Toubro (LT),"Larsen, Peltola and Smith Introduce Bipartisan Bill to Combat Childhood Hunger, Expand Access to Meals Outside of Regular School Hours",2024-08-28 19:07:30
Larsen & Toubro (LT),Obituary for Rose Larsen at Unger-Horner Funeral Home Rochelle,2024-05-03 07:00:00
Larsen & Toubro (LT),Larsen Statement on House-Passed Defense Policy Bill,2024-06-14 07:00:00
Larsen & Toubro (LT),"Shirley ""Shirl"" Larsen Obituary 2024",2024-05-15 07:00:00
Larsen & Toubro (LT),Tickets still available to attend Dayton Chef’s Challenge,2024-09-12 09:00:49
Larsen & Toubro (LT),Lindsey Larsen Obituary 2023,2023-11-21 08:00:00
Larsen & Toubro (LT),Missoula's Chloe Larsen found 'right opportunity' with hometown Lady Griz,2024-07-13 07:00:00
Larsen & Toubro (LT),"Senator Murray, Rep. Larsen Reintroduce Legislation to Reauthorize Northwest Straits Commission",2024-06-18 07:00:00
Larsen & Toubro (LT),Fifth Generation Aggie Celina Larsen Honored as CEHS Valedictorian,2024-05-02 07:00:00
Larsen & Toubro (LT),"Karen Dobson Obituary | September 9, 2024 | Wood Funeral Home & Crematory - Ammon, ID",2024-09-09 07:00:00
Larsen & Toubro (LT),Wolves’ new striker Jorgen Strand Larsen – the No 9 fans have been craving - The Athletic,2024-07-02 07:00:00
Larsen & Toubro (LT),Deputy Chief Dennis Larsen named chief of Tulsa police,2024-05-24 07:00:00
Larsen & Toubro (LT),Megan Larsen Obituary 2023,2023-11-19 08:00:00
Larsen & Toubro (LT),Court dismisses lawsuit against Papillion-La Vista Schools in Ryan Larsen case,2024-05-20 07:00:00
Kotak Mahindra Bank (KOTAKBANK),Kotak Mahindra Bank Limited (NSE:KOTAKBANK) is a favorite amongst institutional investors who own 45%,2024-09-17 00:32:40
Kotak Mahindra Bank (KOTAKBANK),"Buy Kotak Mahindra Bank, target price Rs 2050: Anand Rathi",2024-09-17 03:52:01
Kotak Mahindra Bank (KOTAKBANK),RBI bars Kotak Bank from adding new online customers and credit cards,2024-04-24 07:00:00
Kotak Mahindra Bank (KOTAKBANK),"Adani-Hindenburg Case: Kotak Bank created, oversaw fund used to bet against Adani, claims US short-seller | Company Business News",2024-07-02 07:00:00
Kotak Mahindra Bank (KOTAKBANK),KOTAKBANK Outlook for the Week,2024-09-13 07:00:00
Kotak Mahindra Bank (KOTAKBANK),"Kotak Mahindra Bank Pulls A Houdini On The Charts, Says Analyst",2024-05-06 07:00:00
Kotak Mahindra Bank (KOTAKBANK),"Kotak Bank MD & CEO Ashok Vaswani: 'Crucial to scale for relevance, not just for the sake of size'",2024-07-14 07:00:00
Kotak Mahindra Bank (KOTAKBANK),Kotak Bank created fund used to bet against Adani: Short-seller Hindenburg after Sebi notice,2024-07-01 07:00:00
Kotak Mahindra Bank (KOTAKBANK),"Kotak Bank Q1 preview: Loan growth to drive profit, NII; margin pressure likely",2024-07-19 07:00:00
Kotak Mahindra Bank (KOTAKBANK),Investing in Kotak Mahindra Bank (NSE:KOTAKBANK) five years ago would have delivered you a 21% gain,2024-08-17 07:00:00
Kotak Mahindra Bank (KOTAKBANK),Operations continue uninterrupted: Kotak Mahindra Bank CEO Ashok Vaswani writes to customers amid RBI acti,2024-04-25 07:00:00
